name,safe_name,price,link,image,file,original_file,processed_file,processed_size
Doritos Storm Flamin Hot Süper Boy 125 G,Doritos Storm Flamin Hot Süper Boy 125 G,58.95,https://www.migros.com.tr/doritos-storm-flamin-hot-super-boy-125-g-p-4d84eb,https://images.migrosone.com/sanalmarket/product/05080299/05080299_1-e7d49b.jpeg,snack_Doritos Storm Flamin Hot Süper Boy 125 G.jpg,snack_Doritos Storm Flamin Hot Süper Boy 125 G.jpg,processed\snack_Doritos Storm Flamin Hot Süper Boy 125 G.jpg,330x330
Doritos Storm Bi Tık Acı Süper Boy 125 G,Doritos Storm Bi Tık Acı Süper Boy 125 G,58.95,https://www.migros.com.tr/doritos-storm-bi-tik-aci-super-boy-125-g-p-4d84e4,https://images.migrosone.com/sanalmarket/product/05080292/05080292_1-c8d8b2.jpg,snack_Doritos Storm Bi Tık Acı Süper Boy 125 G.jpg,snack_Doritos Storm Bi Tık Acı Süper Boy 125 G.jpg,processed\snack_Doritos Storm Bi Tık Acı Süper Boy 125 G.jpg,330x330
Doritos Storm Tatlı Acı Süper Boy 125 G,Doritos Storm Tatlı Acı Süper Boy 125 G,58.95,https://www.migros.com.tr/doritos-storm-tatli-aci-super-boy-125-g-p-4d84e5,https://images.migrosone.com/sanalmarket/product/05080293/05080293_1-e22e61.jpeg,snack_Doritos Storm Tatlı Acı Süper Boy 125 G.jpg,snack_Doritos Storm Tatlı Acı Süper Boy 125 G.jpg,processed\snack_Doritos Storm Tatlı Acı Süper Boy 125 G.jpg,330x330
Doritos Twist Kırmızı Köz Biberli 115 G,Doritos Twist Kırmızı Köz Biberli 115 G,58.95,https://www.migros.com.tr/doritos-twist-kirmizi-koz-biberli-115-g-p-4d84b0,https://images.migrosone.com/sanalmarket/product/05080240/05080240_1-e16105.jpg,snack_Doritos Twist Kırmızı Köz Biberli 115 G.jpg,snack_Doritos Twist Kırmızı Köz Biberli 115 G.jpg,processed\snack_Doritos Twist Kırmızı Köz Biberli 115 G.jpg,330x330
Doritos Taco Baharatlı Mısır Cipsi Süper Boy 135 G,Doritos Taco Baharatlı Mısır Cipsi Süper Boy 135 G,,https://www.migros.com.tr/doritos-taco-baharatli-misir-cipsi-super-boy-135-g-p-4d845e,https://images.migrosone.com/sanalmarket/product/05080158/05080158_1-bc8451.jpg,snack_Doritos Taco Baharatlı Mısır Cipsi Süper Boy 135 G.jpg,snack_Doritos Taco Baharatlı Mısır Cipsi Süper Boy 135 G.jpg,processed\snack_Doritos Taco Baharatlı Mısır Cipsi Süper Boy 135 G.jpg,330x330
Doritos Taco Parti Boy 185 G,Doritos Taco Parti Boy 185 G,,https://www.migros.com.tr/doritos-taco-parti-boy-185-g-p-4d845f,https://images.migrosone.com/sanalmarket/product/05080159/05080159_1-3f9b6d.jpg,snack_Doritos Taco Parti Boy 185 G.jpg,snack_Doritos Taco Parti Boy 185 G.jpg,processed\snack_Doritos Taco Parti Boy 185 G.jpg,330x330
Doritos Nacho Süper Boy 130 G,Doritos Nacho Süper Boy 130 G,,https://www.migros.com.tr/doritos-nacho-super-boy-130-g-p-4d8460,https://images.migrosone.com/sanalmarket/product/05080160/05080160_1-bcfc8c.jpg,snack_Doritos Nacho Süper Boy 130 G.jpg,snack_Doritos Nacho Süper Boy 130 G.jpg,processed\snack_Doritos Nacho Süper Boy 130 G.jpg,330x330
Doritos Dippas Mısır Cipsi Parti Boy 140 G,Doritos Dippas Mısır Cipsi Parti Boy 140 G,,https://www.migros.com.tr/doritos-dippas-misir-cipsi-parti-boy-140-g-p-4d83e0,https://images.migrosone.com/sanalmarket/product/05080032/05080032-981526.jpeg,snack_Doritos Dippas Mısır Cipsi Parti Boy 140 G.jpg,snack_Doritos Dippas Mısır Cipsi Parti Boy 140 G.jpg,processed\snack_Doritos Dippas Mısır Cipsi Parti Boy 140 G.jpg,330x330
Doritos Hot Corn Acı Biberli Mısır Cipsi Süper Boy 130 G,Doritos Hot Corn Acı Biberli Mısır Cipsi Süper Boy 130 G,,https://www.migros.com.tr/doritos-hot-corn-aci-biberli-misir-cipsi-super-boy-130-g-p-4d8462,https://images.migrosone.com/sanalmarket/product/05080162/05080162_1-515d0f.jpg,snack_Doritos Hot Corn Acı Biberli Mısır Cipsi Süper Boy 130 G.jpg,snack_Doritos Hot Corn Acı Biberli Mısır Cipsi Süper Boy 130 G.jpg,processed\snack_Doritos Hot Corn Acı Biberli Mısır Cipsi Süper Boy 130 G.jpg,330x330
Tadelle Fındık Dolgulu Sütlü Çikolata 3 x 52 G,Tadelle Fındık Dolgulu Sütlü Çikolata 3 x 52 G,187.50,https://www.migros.com.tr/tadelle-findik-dolgulu-sutlu-cikolata-3-x-52-g-p-6b4ae0,https://images.migrosone.com/sanalmarket/product/07031520/07031520_1-fa5b2b.jpg,snack_Tadelle Fındık Dolgulu Sütlü Çikolata 3 x 52 G.jpg,snack_Tadelle Fındık Dolgulu Sütlü Çikolata 3 x 52 G.jpg,processed\snack_Tadelle Fındık Dolgulu Sütlü Çikolata 3 x 52 G.jpg,330x330
Eti Gong Mısır ve Pirinç Patlağı 64 G,Eti Gong Mısır ve Pirinç Patlağı 64 G,25.90,https://www.migros.com.tr/eti-gong-misir-ve-pirinc-patlagi-64-g-p-6aff31,https://images.migrosone.com/sanalmarket/product/07012145/07012145-36cdc0.jpg,snack_Eti Gong Mısır ve Pirinç Patlağı 64 G.jpg,snack_Eti Gong Mısır ve Pirinç Patlağı 64 G.jpg,processed\snack_Eti Gong Mısır ve Pirinç Patlağı 64 G.jpg,330x330
Eti Browni Intense Çikolatalı Kek 50 G,Eti Browni Intense Çikolatalı Kek 50 G,24.95,https://www.migros.com.tr/eti-browni-intense-cikolatali-kek-50-g-p-4dcae1,https://images.migrosone.com/sanalmarket/product/05098209/eti-browni-intense-50-gr-bb8473.jpg,snack_Eti Browni Intense Çikolatalı Kek 50 G.jpg,snack_Eti Browni Intense Çikolatalı Kek 50 G.jpg,processed\snack_Eti Browni Intense Çikolatalı Kek 50 G.jpg,330x330
Eti Karam Gurme Bitter Çikolatalı Gofret 50 g,Eti Karam Gurme Bitter Çikolatalı Gofret 50 g,29.95,https://www.migros.com.tr/eti-karam-gurme-bitter-cikolatali-gofret-50-g-p-6d43f1,https://images.migrosone.com/sanalmarket/product/7160817/7160817-b58034.jpg,snack_Eti Karam Gurme Bitter Çikolatalı Gofret 50 g.jpg,snack_Eti Karam Gurme Bitter Çikolatalı Gofret 50 g.jpg,processed\snack_Eti Karam Gurme Bitter Çikolatalı Gofret 50 g.jpg,330x330
Eti Karam %70 Kakaolu Bitter Çikolata 60 G,Eti Karam %70 Kakaolu Bitter Çikolata 60 G,66.95,https://www.migros.com.tr/eti-karam-70-kakaolu-bitter-cikolata-60-g-p-6b5dd4,https://images.migrosone.com/sanalmarket/product/07036372/07036372-b80d70.jpg,snack_Eti Karam %70 Kakaolu Bitter Çikolata 60 G.jpg,snack_Eti Karam %70 Kakaolu Bitter Çikolata 60 G.jpg,processed\snack_Eti Karam %70 Kakaolu Bitter Çikolata 60 G.jpg,330x330
Eti Tutku Tart 45 G,Eti Tutku Tart 45 G,20.00,https://www.migros.com.tr/eti-tutku-tart-45-g-p-6b0026,https://images.migrosone.com/sanalmarket/product/07012390/07012390_1-aa0216.jpg,snack_Eti Tutku Tart 45 G.jpg,snack_Eti Tutku Tart 45 G.jpg,processed\snack_Eti Tutku Tart 45 G.jpg,330x330
Biscolata Stix Sütlü 40 G,Biscolata Stix Sütlü 40 G,30.00,https://www.migros.com.tr/biscolata-stix-sutlu-40-g-p-6afb60,https://images.migrosone.com/sanalmarket/product/07011168/7011168-1c510f.jpg,snack_Biscolata Stix Sütlü 40 G.jpg,snack_Biscolata Stix Sütlü 40 G.jpg,processed\snack_Biscolata Stix Sütlü 40 G.jpg,330x330
Eti Crax Çubuk Kraker 40 G,Eti Crax Çubuk Kraker 40 G,7.50,https://www.migros.com.tr/eti-crax-cubuk-kraker-40-g-p-6af799,https://images.migrosone.com/sanalmarket/product/07010201/07010201-e024e5.jpg,snack_Eti Crax Çubuk Kraker 40 G.jpg,snack_Eti Crax Çubuk Kraker 40 G.jpg,processed\snack_Eti Crax Çubuk Kraker 40 G.jpg,330x330
Eti Browni Gold Çikolatalı Kek 45 G,Eti Browni Gold Çikolatalı Kek 45 G,14.95,https://www.migros.com.tr/eti-browni-gold-cikolatali-kek-45-g-p-4de182,https://images.migrosone.com/sanalmarket/product/05104002/5104002_1-1cbfbd.jpg,snack_Eti Browni Gold Çikolatalı Kek 45 G.jpg,snack_Eti Browni Gold Çikolatalı Kek 45 G.jpg,processed\snack_Eti Browni Gold Çikolatalı Kek 45 G.jpg,330x330
Eti Tutku Kakao Kremalı Mozaik Bisküvi 100 G,Eti Tutku Kakao Kremalı Mozaik Bisküvi 100 G,25.00,https://www.migros.com.tr/eti-tutku-kakao-kremali-mozaik-biskuvi-100-g-p-6afaa3,https://images.migrosone.com/sanalmarket/product/7010979/7010979-37b062.jpg,snack_Eti Tutku Kakao Kremalı Mozaik Bisküvi 100 G.jpg,snack_Eti Tutku Kakao Kremalı Mozaik Bisküvi 100 G.jpg,processed\snack_Eti Tutku Kakao Kremalı Mozaik Bisküvi 100 G.jpg,330x330
Migros İç Ceviz 150 G,Migros İç Ceviz 150 G,109.00,https://www.migros.com.tr/migros-ic-ceviz-150-g-p-7b49d3,https://images.migrosone.com/sanalmarket/product/08079827/08079827-a4c8ee.jpg,snack_Migros İç Ceviz 150 G.jpg,snack_Migros İç Ceviz 150 G.jpg,processed\snack_Migros İç Ceviz 150 G.jpg,330x330
Biscolata Mood Bardak 125 G,Biscolata Mood Bardak 125 G,56.00,https://www.migros.com.tr/biscolata-mood-bardak-125-g-p-6b1cae,https://images.migrosone.com/sanalmarket/product/07019694/7019694-6470ba.jpg,snack_Biscolata Mood Bardak 125 G.jpg,snack_Biscolata Mood Bardak 125 G.jpg,processed\snack_Biscolata Mood Bardak 125 G.jpg,330x330
Ülker Tuzlu Çubuk Kraker 40 G,Ülker Tuzlu Çubuk Kraker 40 G,7.50,https://www.migros.com.tr/ulker-tuzlu-cubuk-kraker-40-g-p-6af7a1,https://images.migrosone.com/sanalmarket/product/07010209/07010209-1747ff.jpg,snack_Ülker Tuzlu Çubuk Kraker 40 G.jpg,snack_Ülker Tuzlu Çubuk Kraker 40 G.jpg,processed\snack_Ülker Tuzlu Çubuk Kraker 40 G.jpg,330x330
First Sensations Yeşil Nane Aromalı 27 G,First Sensations Yeşil Nane Aromalı 27 G,59.95,https://www.migros.com.tr/first-sensations-yesil-nane-aromali-27-g-p-6ca5a3,https://images.migrosone.com/sanalmarket/product/07120291/07120291-c95372.jpg,snack_First Sensations Yeşil Nane Aromalı 27 G.jpg,snack_First Sensations Yeşil Nane Aromalı 27 G.jpg,processed\snack_First Sensations Yeşil Nane Aromalı 27 G.jpg,330x330
Tadım Kavrulmuş Siyah Ayçekirdeği 180 G,Tadım Kavrulmuş Siyah Ayçekirdeği 180 G,56.00,https://www.migros.com.tr/tadim-kavrulmus-siyah-aycekirdegi-180-g-p-7b70db,https://images.migrosone.com/sanalmarket/product/08089819/8089819-5f54d6.jpg,snack_Tadım Kavrulmuş Siyah Ayçekirdeği 180 G.jpg,snack_Tadım Kavrulmuş Siyah Ayçekirdeği 180 G.jpg,processed\snack_Tadım Kavrulmuş Siyah Ayçekirdeği 180 G.jpg,330x330
Eti Karam Gurme Bitter Çikolata Kremalı Gofret 3'lü 150 G,Eti Karam Gurme Bitter Çikolata Kremalı Gofret 3'lü 150 G,89.50,https://www.migros.com.tr/eti-karam-gurme-bitter-cikolata-kremali-gofret-3lu-150-g-p-6d5053,https://images.migrosone.com/sanalmarket/product/07163987/07163987-235c4a.jpg,snack_Eti Karam Gurme Bitter Çikolata Kremalı Gofret 3'lü 150 G.jpg,snack_Eti Karam Gurme Bitter Çikolata Kremalı Gofret 3'lü 150 G.jpg,processed\snack_Eti Karam Gurme Bitter Çikolata Kremalı Gofret 3'lü 150 G.jpg,330x330
Eti Browni Gold Vişneli Çikolatalı Kek 45 G,Eti Browni Gold Vişneli Çikolatalı Kek 45 G,14.95,https://www.migros.com.tr/eti-browni-gold-visneli-cikolatali-kek-45-g-p-4de181,https://images.migrosone.com/sanalmarket/product/05104001/5104001-9c71b6.jpg,snack_Eti Browni Gold Vişneli Çikolatalı Kek 45 G.jpg,snack_Eti Browni Gold Vişneli Çikolatalı Kek 45 G.jpg,processed\snack_Eti Browni Gold Vişneli Çikolatalı Kek 45 G.jpg,330x330
Eti Browni Intense Mini Çikolatalı Kek 160 G,Eti Browni Intense Mini Çikolatalı Kek 160 G,84.95,https://www.migros.com.tr/eti-browni-intense-mini-cikolatali-kek-160-g-p-4dcb15,https://images.migrosone.com/sanalmarket/product/05098261/05098261_1-f25afe.jpg,snack_Eti Browni Intense Mini Çikolatalı Kek 160 G.jpg,snack_Eti Browni Intense Mini Çikolatalı Kek 160 G.jpg,processed\snack_Eti Browni Intense Mini Çikolatalı Kek 160 G.jpg,330x330
Kahve Dünyası Tambol Fındıklı Sütlü Çikolata 77 G,Kahve Dünyası Tambol Fındıklı Sütlü Çikolata 77 G,84.95,https://www.migros.com.tr/kahve-dunyasi-tambol-findikli-sutlu-cikolata-77-g-p-6b9426,https://images.migrosone.com/sanalmarket/product/07050278/7050278_1-b27f20.jpg,snack_Kahve Dünyası Tambol Fındıklı Sütlü Çikolata 77 G.jpg,snack_Kahve Dünyası Tambol Fındıklı Sütlü Çikolata 77 G.jpg,processed\snack_Kahve Dünyası Tambol Fındıklı Sütlü Çikolata 77 G.jpg,330x330
Eti Burçak Tam Buğday Unlu Bisküvi 3 x 131 G,Eti Burçak Tam Buğday Unlu Bisküvi 3 x 131 G,72.95,https://www.migros.com.tr/eti-burcak-tam-bugday-unlu-biskuvi-3-x-131-g-p-6af755,https://images.migrosone.com/sanalmarket/product/07010133/07010133-2cad2d.jpg,snack_Eti Burçak Tam Buğday Unlu Bisküvi 3 x 131 G.jpg,snack_Eti Burçak Tam Buğday Unlu Bisküvi 3 x 131 G.jpg,processed\snack_Eti Burçak Tam Buğday Unlu Bisküvi 3 x 131 G.jpg,330x330
Tadım Bol Tuzlu Kavrulmuş Siyah Ayçekirdek 180 G,Tadım Bol Tuzlu Kavrulmuş Siyah Ayçekirdek 180 G,56.00,https://www.migros.com.tr/tadim-bol-tuzlu-kavrulmus-siyah-aycekirdek-180-g-p-7b716a,https://images.migrosone.com/sanalmarket/product/08089962/8089962-d53d61.jpg,snack_Tadım Bol Tuzlu Kavrulmuş Siyah Ayçekirdek 180 G.jpg,snack_Tadım Bol Tuzlu Kavrulmuş Siyah Ayçekirdek 180 G.jpg,processed\snack_Tadım Bol Tuzlu Kavrulmuş Siyah Ayçekirdek 180 G.jpg,330x330
Torku Gala Gold Çikolata Kaplamalı Çikolata Soslu Kek 45 G,Torku Gala Gold Çikolata Kaplamalı Çikolata Soslu Kek 45 G,21.50,https://www.migros.com.tr/torku-gala-gold-cikolata-kaplamali-cikolata-soslu-kek-45-g-p-6b4ae1,https://images.migrosone.com/sanalmarket/product/07031521/07031521_1-7aaa79.jpg,choco_Torku Gala Gold Çikolata Kaplamalı Çikolata Soslu Kek 45 G.jpg,choco_Torku Gala Gold Çikolata Kaplamalı Çikolata Soslu Kek 45 G.jpg,processed\choco_Torku Gala Gold Çikolata Kaplamalı Çikolata Soslu Kek 45 G.jpg,330x330
Çokonat Kaplı Gofret 33 G,Çokonat Kaplı Gofret 33 G,24.95,https://www.migros.com.tr/cokonat-kapli-gofret-33-g-p-6d40e3,https://images.migrosone.com/sanalmarket/product/07160035/7160035_1-5b5692.jpg,choco_Çokonat Kaplı Gofret 33 G.jpg,choco_Çokonat Kaplı Gofret 33 G.jpg,processed\choco_Çokonat Kaplı Gofret 33 G.jpg,330x330
Eti Canga Yerfıstığı Kaplı Fındık Kremalı Gofret 34 G,Eti Canga Yerfıstığı Kaplı Fındık Kremalı Gofret 34 G,21.95,https://www.migros.com.tr/eti-canga-yerfistigi-kapli-findik-kremali-gofret-34-g-p-6d5c8c,https://images.migrosone.com/sanalmarket/product/07167116/07167116-3797bf.jpg,choco_Eti Canga Yerfıstığı Kaplı Fındık Kremalı Gofret 34 G.jpg,choco_Eti Canga Yerfıstığı Kaplı Fındık Kremalı Gofret 34 G.jpg,processed\choco_Eti Canga Yerfıstığı Kaplı Fındık Kremalı Gofret 34 G.jpg,330x330
Biscolata Starz Sütlü Çikolata Kaplamalı Bisküvi 82 G,Biscolata Starz Sütlü Çikolata Kaplamalı Bisküvi 82 G,29.90,https://www.migros.com.tr/biscolata-starz-sutlu-cikolata-kaplamali-biskuvi-82-g-p-6afd74,https://images.migrosone.com/sanalmarket/product/07011700/7011700-5df785.jpg,choco_Biscolata Starz Sütlü Çikolata Kaplamalı Bisküvi 82 G.jpg,choco_Biscolata Starz Sütlü Çikolata Kaplamalı Bisküvi 82 G.jpg,processed\choco_Biscolata Starz Sütlü Çikolata Kaplamalı Bisküvi 82 G.jpg,330x330
Biscolata Starz Bitter Çikolata Kakaolu Bisküvi 82 G,Biscolata Starz Bitter Çikolata Kakaolu Bisküvi 82 G,29.90,https://www.migros.com.tr/biscolata-starz-bitter-cikolata-kakaolu-biskuvi-82-g-p-6afd75,https://images.migrosone.com/sanalmarket/product/07011701/7011701-36661c.jpg,choco_Biscolata Starz Bitter Çikolata Kakaolu Bisküvi 82 G.jpg,choco_Biscolata Starz Bitter Çikolata Kakaolu Bisküvi 82 G.jpg,processed\choco_Biscolata Starz Bitter Çikolata Kakaolu Bisküvi 82 G.jpg,330x330
Çizmeci Time Up Sütlü Çikolatalı Sütlü Kremalı Bisküvi 30 G,Çizmeci Time Up Sütlü Çikolatalı Sütlü Kremalı Bisküvi 30 G,22.50,https://www.migros.com.tr/cizmeci-time-up-sutlu-cikolatali-sutlu-kremali-biskuvi-30-g-p-6d43de,https://images.migrosone.com/sanalmarket/product/07160798/07160798-bb7745.jpg,choco_Çizmeci Time Up Sütlü Çikolatalı Sütlü Kremalı Bisküvi 30 G.jpg,choco_Çizmeci Time Up Sütlü Çikolatalı Sütlü Kremalı Bisküvi 30 G.jpg,processed\choco_Çizmeci Time Up Sütlü Çikolatalı Sütlü Kremalı Bisküvi 30 G.jpg,330x330
Çizmeci Time Up Sütlü Çikolata Karamel Kremalı Bisküvi 30 G,Çizmeci Time Up Sütlü Çikolata Karamel Kremalı Bisküvi 30 G,22.50,https://www.migros.com.tr/cizmeci-time-up-sutlu-cikolata-karamel-kremali-biskuvi-30-g-p-6af7dc,https://images.migrosone.com/sanalmarket/product/07010268/07010268-e77e51.jpg,choco_Çizmeci Time Up Sütlü Çikolata Karamel Kremalı Bisküvi 30 G.jpg,choco_Çizmeci Time Up Sütlü Çikolata Karamel Kremalı Bisküvi 30 G.jpg,processed\choco_Çizmeci Time Up Sütlü Çikolata Karamel Kremalı Bisküvi 30 G.jpg,330x330
Alpimilk Çikolatalı Süt 180 Ml,Alpimilk Çikolatalı Süt 180 Ml,22.90,https://www.migros.com.tr/alpimilk-cikolatali-sut-180-ml-p-b03d4e,https://images.migrosone.com/sanalmarket/product/11550030/11550030_1-ecd614.jpg,choco_Alpimilk Çikolatalı Süt 180 Ml.jpg,choco_Alpimilk Çikolatalı Süt 180 Ml.jpg,processed\choco_Alpimilk Çikolatalı Süt 180 Ml.jpg,330x330
Saklıköy Çikolata Kremalı Bisküvi 87 G,Saklıköy Çikolata Kremalı Bisküvi 87 G,22.95,https://www.migros.com.tr/saklikoy-cikolata-kremali-biskuvi-87-g-p-6b1cd3,https://images.migrosone.com/sanalmarket/product/07019731/07019731-d642e7.jpg,choco_Saklıköy Çikolata Kremalı Bisküvi 87 G.jpg,choco_Saklıköy Çikolata Kremalı Bisküvi 87 G.jpg,processed\choco_Saklıköy Çikolata Kremalı Bisküvi 87 G.jpg,330x330
Eti Karam Gurme Bitter Çikolatalı Gofret 50 g,Eti Karam Gurme Bitter Çikolatalı Gofret 50 g,29.95,https://www.migros.com.tr/eti-karam-gurme-bitter-cikolatali-gofret-50-g-p-6d43f1,https://images.migrosone.com/sanalmarket/product/7160817/7160817-b58034.jpg,choco_Eti Karam Gurme Bitter Çikolatalı Gofret 50 g.jpg,choco_Eti Karam Gurme Bitter Çikolatalı Gofret 50 g.jpg,processed\choco_Eti Karam Gurme Bitter Çikolatalı Gofret 50 g.jpg,330x330
Dr.Oetker Bardakta Puding Çikolata Parçalı Vanilin 32 G,Dr.Oetker Bardakta Puding Çikolata Parçalı Vanilin 32 G,23.95,https://www.migros.com.tr/droetker-bardakta-puding-cikolata-parcali-vanilin-32-g-p-6c57e0,https://images.migrosone.com/sanalmarket/product/07100384/07100384_1-a1f195.jpg,choco_Dr.Oetker Bardakta Puding Çikolata Parçalı Vanilin 32 G.jpg,choco_Dr.Oetker Bardakta Puding Çikolata Parçalı Vanilin 32 G.jpg,processed\choco_Dr.Oetker Bardakta Puding Çikolata Parçalı Vanilin 32 G.jpg,330x330
Ülker Laviva Dolgulu ve Bisküvili Çikolata 35 G,Ülker Laviva Dolgulu ve Bisküvili Çikolata 35 G,27.50,https://www.migros.com.tr/ulker-laviva-dolgulu-ve-biskuvili-cikolata-35-g-p-6b46cc,https://images.migrosone.com/sanalmarket/product/07030476/ulker-laviva-dolgulu-ve-biskuvili-cikolata-35-gr-80ac2b.jpg,choco_Ülker Laviva Dolgulu ve Bisküvili Çikolata 35 G.jpg,choco_Ülker Laviva Dolgulu ve Bisküvili Çikolata 35 G.jpg,processed\choco_Ülker Laviva Dolgulu ve Bisküvili Çikolata 35 G.jpg,330x330
Nutmaster Kakaolu Fındık Kreması & Grisini 52G,Nutmaster Kakaolu Fındık Kreması & Grisini 52G,24.50,https://www.migros.com.tr/nutmaster-kakaolu-findik-kremasi-grisini-52g-p-6d19dc,https://images.migrosone.com/sanalmarket/product/07150044/07150044-cc1f35.jpg,choco_Nutmaster Kakaolu Fındık Kreması & Grisini 52G.jpg,choco_Nutmaster Kakaolu Fındık Kreması & Grisini 52G.jpg,processed\choco_Nutmaster Kakaolu Fındık Kreması & Grisini 52G.jpg,330x330
Torku No:1 Extra Çikolatalı Gofret 35 G,Torku No_1 Extra Çikolatalı Gofret 35 G,24.50,https://www.migros.com.tr/torku-no1-extra-cikolatali-gofret-35-g-p-6af81c,https://images.migrosone.com/sanalmarket/product/07010332/07010332-77d7f0.jpg,choco_Torku No_1 Extra Çikolatalı Gofret 35 G.jpg,choco_Torku No_1 Extra Çikolatalı Gofret 35 G.jpg,processed\choco_Torku No_1 Extra Çikolatalı Gofret 35 G.jpg,330x330
Torku 1 Daha Fındık Kremalı Gofretli Sütlü Çikolatalı 32 G,Torku 1 Daha Fındık Kremalı Gofretli Sütlü Çikolatalı 32 G,24.95,https://www.migros.com.tr/torku-1-daha-findik-kremali-gofretli-sutlu-cikolatali-32-g-p-6b7548,https://images.migrosone.com/sanalmarket/product/07042376/7042376-c6933c.jpg,choco_Torku 1 Daha Fındık Kremalı Gofretli Sütlü Çikolatalı 32 G.jpg,choco_Torku 1 Daha Fındık Kremalı Gofretli Sütlü Çikolatalı 32 G.jpg,processed\choco_Torku 1 Daha Fındık Kremalı Gofretli Sütlü Çikolatalı 32 G.jpg,330x330
Ozmo Hoppo Çikolatalı Krema Dolgulu Bisküvi 40 G,Ozmo Hoppo Çikolatalı Krema Dolgulu Bisküvi 40 G,24.95,https://www.migros.com.tr/ozmo-hoppo-cikolatali-krema-dolgulu-biskuvi-40-g-p-6b1caa,https://images.migrosone.com/sanalmarket/product/07019690/7019690-89a33d.jpg,choco_Ozmo Hoppo Çikolatalı Krema Dolgulu Bisküvi 40 G.jpg,choco_Ozmo Hoppo Çikolatalı Krema Dolgulu Bisküvi 40 G.jpg,processed\choco_Ozmo Hoppo Çikolatalı Krema Dolgulu Bisküvi 40 G.jpg,330x330
Albeni Çikolata Kaplamalı Kek 43 G,Albeni Çikolata Kaplamalı Kek 43 G,24.95,https://www.migros.com.tr/albeni-cikolata-kaplamali-kek-43-g-p-4dad11,https://images.migrosone.com/sanalmarket/product/05090577/ulker-albeni-kaplamali-cikolatali-kek-35-gr-37f2ff.jpg,choco_Albeni Çikolata Kaplamalı Kek 43 G.jpg,choco_Albeni Çikolata Kaplamalı Kek 43 G.jpg,processed\choco_Albeni Çikolata Kaplamalı Kek 43 G.jpg,330x330
Migros Çikolatalı Puding Toz Karışımı 150 G,Migros Çikolatalı Puding Toz Karışımı 150 G,24.95,https://www.migros.com.tr/migros-cikolatali-puding-toz-karisimi-150-g-p-6c5787,https://images.migrosone.com/sanalmarket/product/07100295/07100295_1-f41c99.jpg,choco_Migros Çikolatalı Puding Toz Karışımı 150 G.jpg,choco_Migros Çikolatalı Puding Toz Karışımı 150 G.jpg,processed\choco_Migros Çikolatalı Puding Toz Karışımı 150 G.jpg,330x330
Eti Browni Intense Gold Beyaz Çikolata Krema Dolgulu Kek 48 G,Eti Browni Intense Gold Beyaz Çikolata Krema Dolgulu Kek 48 G,24.95,https://www.migros.com.tr/eti-browni-intense-gold-beyaz-cikolata-krema-dolgulu-kek-48-g-p-4deb85,https://images.migrosone.com/sanalmarket/product/05106565/05106565-f52b29.jpg,choco_Eti Browni Intense Gold Beyaz Çikolata Krema Dolgulu Kek 48 G.jpg,choco_Eti Browni Intense Gold Beyaz Çikolata Krema Dolgulu Kek 48 G.jpg,processed\choco_Eti Browni Intense Gold Beyaz Çikolata Krema Dolgulu Kek 48 G.jpg,330x330
Eti Browni Intense Çikolatalı Kek 50 G,Eti Browni Intense Çikolatalı Kek 50 G,24.95,https://www.migros.com.tr/eti-browni-intense-cikolatali-kek-50-g-p-4dcae1,https://images.migrosone.com/sanalmarket/product/05098209/eti-browni-intense-50-gr-bb8473.jpg,choco_Eti Browni Intense Çikolatalı Kek 50 G.jpg,choco_Eti Browni Intense Çikolatalı Kek 50 G.jpg,processed\choco_Eti Browni Intense Çikolatalı Kek 50 G.jpg,330x330
Sarelle Gold Gofret 33 G,Sarelle Gold Gofret 33 G,25.00,https://www.migros.com.tr/sarelle-gold-gofret-33-g-p-6d40c4,https://images.migrosone.com/sanalmarket/product/07160004/7160004-a00dee.jpg,choco_Sarelle Gold Gofret 33 G.jpg,choco_Sarelle Gold Gofret 33 G.jpg,processed\choco_Sarelle Gold Gofret 33 G.jpg,330x330
Sarelle Orman Meyveli Gofret 33 G,Sarelle Orman Meyveli Gofret 33 G,25.00,https://www.migros.com.tr/sarelle-orman-meyveli-gofret-33-g-p-6b49b6,https://images.migrosone.com/sanalmarket/product/07031222/07031222_1-c3505a.jpg,choco_Sarelle Orman Meyveli Gofret 33 G.jpg,choco_Sarelle Orman Meyveli Gofret 33 G.jpg,processed\choco_Sarelle Orman Meyveli Gofret 33 G.jpg,330x330
Eti Gong Sütlü Kakao Kaplamalı 30 G,Eti Gong Sütlü Kakao Kaplamalı 30 G,25.00,https://www.migros.com.tr/eti-gong-sutlu-kakao-kaplamali-30-g-p-6b4aeb,https://images.migrosone.com/sanalmarket/product/07031531/7031531_1-861c86.jpg,choco_Eti Gong Sütlü Kakao Kaplamalı 30 G.jpg,choco_Eti Gong Sütlü Kakao Kaplamalı 30 G.jpg,processed\choco_Eti Gong Sütlü Kakao Kaplamalı 30 G.jpg,330x330
Eti Gong Çilekli Yoğurtlu Kaplamalı 30 G,Eti Gong Çilekli Yoğurtlu Kaplamalı 30 G,25.00,https://www.migros.com.tr/eti-gong-cilekli-yogurtlu-kaplamali-30-g-p-6b4aea,https://images.migrosone.com/sanalmarket/product/07031530/7031530_1-62220b.jpg,choco_Eti Gong Çilekli Yoğurtlu Kaplamalı 30 G.jpg,choco_Eti Gong Çilekli Yoğurtlu Kaplamalı 30 G.jpg,processed\choco_Eti Gong Çilekli Yoğurtlu Kaplamalı 30 G.jpg,330x330
Ozmo Fun Meslekler Serisi Figürlü Çikolatalar 23 G,Ozmo Fun Meslekler Serisi Figürlü Çikolatalar 23 G,25.00,https://www.migros.com.tr/ozmo-fun-meslekler-serisi-figurlu-cikolatalar-23-g-p-6b53a7,https://images.migrosone.com/sanalmarket/product/07033767/7033767_1-1b5f89.jpeg,choco_Ozmo Fun Meslekler Serisi Figürlü Çikolatalar 23 G.jpg,choco_Ozmo Fun Meslekler Serisi Figürlü Çikolatalar 23 G.jpg,processed\choco_Ozmo Fun Meslekler Serisi Figürlü Çikolatalar 23 G.jpg,330x330
Sarelle Hindistan Cevizli Gofret 33 G,Sarelle Hindistan Cevizli Gofret 33 G,25.00,https://www.migros.com.tr/sarelle-hindistan-cevizli-gofret-33-g-p-6b5d0c,https://images.migrosone.com/sanalmarket/product/07036172/07036172-f4f7c2.jpg,choco_Sarelle Hindistan Cevizli Gofret 33 G.jpg,choco_Sarelle Hindistan Cevizli Gofret 33 G.jpg,processed\choco_Sarelle Hindistan Cevizli Gofret 33 G.jpg,330x330
Ozmo Fun Figürlü Çikolata 23 G,Ozmo Fun Figürlü Çikolata 23 G,25.00,https://www.migros.com.tr/ozmo-fun-figurlu-cikolata-23-g-p-6b609a,https://images.migrosone.com/sanalmarket/product/07037082/7037082_1-fa3d07.jpeg,choco_Ozmo Fun Figürlü Çikolata 23 G.jpg,choco_Ozmo Fun Figürlü Çikolata 23 G.jpg,processed\choco_Ozmo Fun Figürlü Çikolata 23 G.jpg,330x330
Ülker Dankek Mousse İpeksi Çikolata Kremalı Baton Kek 45 G,Ülker Dankek Mousse İpeksi Çikolata Kremalı Baton Kek 45 G,25.50,https://www.migros.com.tr/ulker-dankek-mousse-ipeksi-cikolata-kremali-baton-kek-45-g-p-6af7d1,https://images.migrosone.com/sanalmarket/product/07010257/07010257-805270.jpg,choco_Ülker Dankek Mousse İpeksi Çikolata Kremalı Baton Kek 45 G.jpg,choco_Ülker Dankek Mousse İpeksi Çikolata Kremalı Baton Kek 45 G.jpg,processed\choco_Ülker Dankek Mousse İpeksi Çikolata Kremalı Baton Kek 45 G.jpg,330x330
Boombastic Marshmallow Çikolatalı Kek Bar 40 G,Boombastic Marshmallow Çikolatalı Kek Bar 40 G,25.90,https://www.migros.com.tr/boombastic-marshmallow-cikolatali-kek-bar-40-g-p-6b5975,https://images.migrosone.com/sanalmarket/product/07035253/07035253-16b49a.jpg,choco_Boombastic Marshmallow Çikolatalı Kek Bar 40 G.jpg,choco_Boombastic Marshmallow Çikolatalı Kek Bar 40 G.jpg,processed\choco_Boombastic Marshmallow Çikolatalı Kek Bar 40 G.jpg,330x330
